{
  "schema": "kage.audio_plan/1",
  "version": "1.0.0",
  "status": "approved",
  "assets": {
    "aud_amb_exterior": {"kind": "ambience", "source": {"type": "synth", "preset": "train_exterior"}, "license": "generated by kage synth (no third-party material)", "loop": true},
    "aud_amb_carriage": {"kind": "ambience", "source": {"type": "synth", "preset": "train_interior"}, "license": "generated by kage synth (no third-party material)", "loop": true},
    "aud_sfx_whistle": {"kind": "sfx", "source": {"type": "synth", "preset": "whistle"}, "license": "generated by kage synth (no third-party material)"},
    "aud_sfx_birds": {"kind": "sfx", "source": {"type": "synth", "preset": "birds", "duration_s": 3.2}, "license": "generated by kage synth (no third-party material)"},
    "aud_sfx_step": {"kind": "sfx", "source": {"type": "synth", "preset": "footstep"}, "license": "generated by kage synth (no third-party material)"},
    "aud_sfx_seat": {"kind": "sfx", "source": {"type": "synth", "preset": "seat_creak"}, "license": "generated by kage synth (no third-party material)"},
    "aud_mus_theme": {"kind": "music", "source": {"type": "synth", "preset": "lullaby", "tempo_bpm": 66}, "license": "generated by kage synth (original, no third-party material)"}
  },
  "events": [
    {"id": "sfx_001", "asset": "aud_sfx_whistle", "anchor": {"shot": "shot_s01_010", "offset_s": 0.6}, "gain_db": -9},
    {"id": "sfx_002", "asset": "aud_sfx_birds", "anchor": {"shot": "shot_s01_010", "offset_s": 0.3}, "gain_db": -14},
    {"id": "sfx_003", "asset": "aud_sfx_seat", "anchor": {"shot": "shot_s02_010", "offset_s": 5.95}, "gain_db": -12},
    {"id": "sfx_004", "asset": "aud_sfx_seat", "anchor": {"shot": "shot_s02_010", "offset_s": 6.4}, "gain_db": -12}
  ],
  "animation_sfx": [
    {"source": "footsteps", "asset": "aud_sfx_step", "shots": ["shot_s02_010"], "characters": ["chr_maya", "chr_lila"], "gain_db": -13, "child_gain_db": -17, "kinds": ["step", "run_step", "settle"]}
  ],
  "ambience": {"by_location": true, "crossfade_s": 0.4, "gain_db": -22},
  "music": [
    {"id": "cue_01", "asset": "aud_mus_theme", "start": {"shot": "shot_s01_010", "offset_s": 0.0}, "end": {"shot": "shot_s02_040", "offset_s": "end"},
     "gain_db": -17, "fade_in_s": 1.5, "fade_out_s": 2.5, "duck_under_dialogue_db": 6, "purpose": "gentle motif under the whole film; ducks under speech"}
  ],
  "silence": []
}
